{
  "kind": "preset",
  "schemaVersion": 1,
  "name": "dark",
  "palette": {
    "background": "#0f172a",
    "text": "#e2e8f0",
    "mutedText": "#94a3b8",
    "nodeFill": "#1e293b",
    "nodeBorder": "#334155",
    "edge": "#475569",
    "branchColors": ["#60a5fa", "#34d399", "#fbbf24", "#f87171", "#a78bfa", "#22d3ee"]
  },
  "roles": {
    "theme": { "fill": "#60a5fa", "text": "#0f172a", "fontWeight": "bold", "shape": "rounded" },
    "main-branch": { "fill": "#1e3a5f", "border": "#60a5fa", "fontWeight": "bold" },
    "branch": { "border": "#64748b" },
    "leaf": { "fill": "#0f172a", "border": "#334155", "shape": "pill" },
    "task": { "fill": "#fbbf24", "text": "#0f172a", "shape": "pill" },
    "idea": { "fill": "#34d399", "text": "#0f172a", "shape": "pill" },
    "question": { "fill": "#a78bfa", "text": "#0f172a", "shape": "pill" },
    "risk": { "fill": "#f87171", "text": "#0f172a", "shape": "pill" }
  },
  "font": { "family": "system-ui, 'Segoe UI', sans-serif", "baseSize": 14, "titleScale": 1.5 },
  "edges": { "curve": "smoothstep", "width": 2, "dashed": false }
}
